{
  "schema_version": 1,
  "routes": [
    {
      "route_id": "interview-preparation",
      "intent_family": "interview-preparation",
      "operation": "interview-preparation",
      "description": "Обследование процессов и подготовка интервью",
      "activation": [
        "Подготовь Excel-реестр процессов и вопросов для обследования закупок.",
        "Выдели требования из ответов приложенного интервью."
      ],
      "exclusions": [
        "Собеседование кандидата на работу; formal импорт готового реестра требований"
      ],
      "boundary_examples": [
        "Не путать с соседним результатом: Собеседование кандидата на работу; formal импорт готового реестра требований",
        "Соседний маршрут: registry"
      ],
      "modes": [
        "explore",
        "draft"
      ],
      "free_primary_skill": "flow1c-interview-preparation",
      "stage_policy": "interview-preparation",
      "sources": [
        "chat",
        "attachment",
        "configuration",
        "extension"
      ],
      "substeps": [],
      "output_contract": "schemas/interview-register.schema.json",
      "clarification": {
        "question": "Какой результат и источник нужны для этой операции?",
        "options": [
          "Обсудить или проверить",
          "Подготовить документ",
          "Выполнить формальный этап"
        ]
      }
    },
    {
      "route_id": "consultation",
      "intent_family": "consultation",
      "operation": "consultation",
      "description": "Объяснение метода и проверка текущего источника",
      "activation": [
        "Объясни подход к проектированию учёта заказов.",
        "Проверь реквизиты заказа в нашей текущей конфигурации."
      ],
      "exclusions": [
        "Конкретный запрос 1С; историческая ветка; mutation расширения"
      ],
      "boundary_examples": [
        "Не путать с соседним результатом: Конкретный запрос 1С; историческая ветка; mutation расширения",
        "Соседний маршрут: query-analysis"
      ],
      "modes": [
        "explore",
        "draft"
      ],
      "free_primary_skill": "flow1c-consultation",
      "stage_policy": "consultation",
      "sources": [
        "chat",
        "attachment",
        "configuration",
        "extension",
        "redmine"
      ],
      "substeps": [
        "redmine-files",
        "redmine-relations"
      ],
      "output_contract": "docs/dialogue.md",
      "clarification": {
        "question": "Какой результат и источник нужны для этой операции?",
        "options": [
          "Обсудить или проверить",
          "Подготовить документ",
          "Выполнить формальный этап"
        ]
      }
    },
    {
      "route_id": "query-analysis",
      "intent_family": "query-analysis",
      "operation": "query-analysis",
      "description": "Создание, проверка и оптимизация текста запроса 1С",
      "activation": [
        "Напиши запрос 1С для подсчёта остатков по складам.",
        "Проверь приложенный текст запроса 1С без базы и XML."
      ],
      "exclusions": [
        "Общее объяснение языка запросов; исполнение запроса в живой базе"
      ],
      "boundary_examples": [
        "Не путать с соседним результатом: Общее объяснение языка запросов; исполнение запроса в живой базе",
        "Соседний маршрут: consultation"
      ],
      "modes": [
        "explore",
        "draft"
      ],
      "free_primary_skill": "flow1c-query-analysis",
      "stage_policy": "query-analysis",
      "sources": [
        "chat",
        "attachment",
        "configuration",
        "extension",
        "git_snapshot"
      ],
      "substeps": [],
      "output_contract": "schemas/query-check.schema.json",
      "clarification": {
        "question": "Какой результат и источник нужны для этой операции?",
        "options": [
          "Обсудить или проверить",
          "Подготовить документ",
          "Выполнить формальный этап"
        ]
      }
    },
    {
      "route_id": "workflow-review",
      "intent_family": "workflow-review",
      "operation": "workflow-review",
      "description": "Read-only проверка правил самого Flow1C",
      "activation": [
        "Проверь правила Flow1C на противоречия.",
        "Подготовь черновой отчёт о структуре workflow."
      ],
      "exclusions": [
        "Обновление установленного продукта; анализ конфигурации 1С"
      ],
      "boundary_examples": [
        "Не путать с соседним результатом: Обновление установленного продукта; анализ конфигурации 1С",
        "Соседний маршрут: update"
      ],
      "modes": [
        "explore",
        "draft"
      ],
      "free_primary_skill": "flow1c-consultation",
      "stage_policy": "workflow-review",
      "sources": [
        "chat",
        "attachment",
        "workflow"
      ],
      "substeps": [],
      "output_contract": "docs/dialogue.md",
      "clarification": {
        "question": "Какой результат и источник нужны для этой операции?",
        "options": [
          "Обсудить или проверить",
          "Подготовить документ",
          "Выполнить формальный этап"
        ]
      }
    },
    {
      "route_id": "setup",
      "intent_family": "setup",
      "operation": "setup",
      "description": "Настройка установки и локальных источников",
      "activation": [
        "Настрой Flow1C для проекта с выбранными путями.",
        "Продолжи прерванную настройку проекта."
      ],
      "exclusions": [
        "Обновление установленной версии; замена шаблона документа"
      ],
      "boundary_examples": [
        "Не путать с соседним результатом: Обновление установленной версии; замена шаблона документа",
        "Соседний маршрут: update"
      ],
      "modes": [
        "formal"
      ],
      "free_primary_skill": null,
      "stage_policy": "setup",
      "sources": [
        "chat",
        "workflow",
        "template_library"
      ],
      "substeps": [
        "template-library"
      ],
      "output_contract": "schemas/agent-gate.schema.json",
      "clarification": {
        "question": "Какой результат и источник нужны для этой операции?",
        "options": [
          "Обсудить или проверить",
          "Подготовить документ",
          "Выполнить формальный этап"
        ]
      }
    },
    {
      "route_id": "update",
      "intent_family": "update",
      "operation": "update",
      "description": "Обновление установки с сохранением состояния",
      "activation": [
        "Обнови Flow1C с сохранением локальных настроек.",
        "Продолжи незавершённое обновление продукта."
      ],
      "exclusions": [
        "Изменение шаблона; изменение расширения 1С"
      ],
      "boundary_examples": [
        "Не путать с соседним результатом: Изменение шаблона; изменение расширения 1С",
        "Соседний маршрут: template-management"
      ],
      "modes": [
        "formal"
      ],
      "free_primary_skill": null,
      "stage_policy": "update",
      "sources": [
        "chat",
        "workflow"
      ],
      "substeps": [
        "template-library"
      ],
      "output_contract": "schemas/update-checkpoint.schema.json",
      "clarification": {
        "question": "Какой результат и источник нужны для этой операции?",
        "options": [
          "Обсудить или проверить",
          "Подготовить документ",
          "Выполнить формальный этап"
        ]
      }
    },
    {
      "route_id": "registry",
      "intent_family": "registry",
      "operation": "registry",
      "description": "Импорт реестра процессов и требований",
      "activation": [
        "Импортируй приложенный Excel-реестр требований.",
        "Проверь структуру реестра перед нормализацией."
      ],
      "exclusions": [
        "Создание вопросов интервью; выдумывание ID требований"
      ],
      "boundary_examples": [
        "Не путать с соседним результатом: Создание вопросов интервью; выдумывание ID требований",
        "Соседний маршрут: interview-preparation"
      ],
      "modes": [
        "formal"
      ],
      "free_primary_skill": null,
      "stage_policy": "registry",
      "sources": [
        "chat",
        "attachment",
        "registry",
        "redmine"
      ],
      "substeps": [
        "redmine-files",
        "redmine-relations"
      ],
      "output_contract": "schemas/registry-status.schema.json",
      "clarification": {
        "question": "Какой результат и источник нужны для этой операции?",
        "options": [
          "Обсудить или проверить",
          "Подготовить документ",
          "Выполнить формальный этап"
        ]
      }
    },
    {
      "route_id": "functional-spec",
      "intent_family": "functional-spec",
      "operation": "functional-spec",
      "description": "Подготовка функциональной спецификации",
      "activation": [
        "Подготовь независимый черновик ФС по моему описанию.",
        "Подготовь формальную ФС по рабочему элементу SYNTHETIC-FS-1."
      ],
      "exclusions": [
        "Согласование готовой ФС; изменение исходников расширения"
      ],
      "boundary_examples": [
        "Не путать с соседним результатом: Согласование готовой ФС; изменение исходников расширения",
        "Соседний маршрут: functional-review"
      ],
      "modes": [
        "explore",
        "draft",
        "formal"
      ],
      "free_primary_skill": "flow1c-consultation",
      "stage_policy": "functional-spec",
      "sources": [
        "chat",
        "attachment",
        "configuration",
        "extension",
        "work_item",
        "registry",
        "template_library",
        "redmine"
      ],
      "substeps": [
        "redmine-files",
        "redmine-relations",
        "template-library"
      ],
      "output_contract": "schemas/manifest.schema.json",
      "clarification": {
        "question": "Какой результат и источник нужны для этой операции?",
        "options": [
          "Обсудить или проверить",
          "Подготовить документ",
          "Выполнить формальный этап"
        ]
      }
    },
    {